{
    "wmo_wis_monitoring": "1.0",
    "centre": "GISC Beijing",
    "timestamp": "2014-11-10T00:00:00Z",
    "events" : 
    [
        {
            "id" : 1,
            "title" : "GISC Beijing Development Maintenance",
            "text" : "This is test message only for monitoring pilot test",
            "start" : "2015-06-01T00:00:00Z",
            "end" : "2015-06-01T02:00:00Z"
        }
    ]
}
